{
  "schema_version": "psb-slsa-build-l2-assessment-input/v1",
  "source": "test-fixture",
  "assessed_at": "2026-07-29T12:30:00Z",
  "scope": {
    "producer_id": "https://producer.example.invalid/product",
    "build_platform_id": "https://build.example.invalid/release",
    "consumer_id": "https://consumer.example.invalid/verifier",
    "artifact_family": "example/product",
    "release_id": "product-v1.2.3",
    "source_revision": "0123456789abcdef0123456789abcdef01234567"
  },
  "evidence_catalog": [
    {
      "code": "platform-policy",
      "type": "platform-policy",
      "issuer_role": "build-platform",
      "uri": "https://evidence.example.invalid/slsa/platform-policy.json",
      "sha256": "1111111111111111111111111111111111111111111111111111111111111111",
      "scope_sha256": "e75cbce01b89a8593197db87886d68ad7f7475e2c7bba3c454c528ddb92fc812",
      "observed_at": "2026-07-29T12:00:00Z",
      "result": "pass",
      "immutable": true,
      "authenticated": true,
      "reviewed": true
    },
    {
      "code": "build-record",
      "type": "build-record",
      "issuer_role": "build-platform",
      "uri": "https://evidence.example.invalid/slsa/build-record.json",
      "sha256": "2222222222222222222222222222222222222222222222222222222222222222",
      "scope_sha256": "e75cbce01b89a8593197db87886d68ad7f7475e2c7bba3c454c528ddb92fc812",
      "observed_at": "2026-07-29T12:00:00Z",
      "result": "pass",
      "immutable": true,
      "authenticated": true,
      "reviewed": true
    },
    {
      "code": "platform-capability-assessment",
      "type": "platform-capability-assessment",
      "issuer_role": "build-platform",
      "uri": "https://evidence.example.invalid/slsa/platform-capability-assessment.json",
      "sha256": "3333333333333333333333333333333333333333333333333333333333333333",
      "scope_sha256": "e75cbce01b89a8593197db87886d68ad7f7475e2c7bba3c454c528ddb92fc812",
      "observed_at": "2026-07-29T12:00:00Z",
      "result": "pass",
      "immutable": true,
      "authenticated": true,
      "reviewed": true
    },
    {
      "code": "producer-policy",
      "type": "producer-policy",
      "issuer_role": "software-producer",
      "uri": "https://evidence.example.invalid/slsa/producer-policy.json",
      "sha256": "4444444444444444444444444444444444444444444444444444444444444444",
      "scope_sha256": "e75cbce01b89a8593197db87886d68ad7f7475e2c7bba3c454c528ddb92fc812",
      "observed_at": "2026-07-29T12:00:00Z",
      "result": "pass",
      "immutable": true,
      "authenticated": true,
      "reviewed": true
    },
    {
      "code": "build-policy",
      "type": "build-policy",
      "issuer_role": "software-producer",
      "uri": "https://evidence.example.invalid/slsa/build-policy.json",
      "sha256": "5555555555555555555555555555555555555555555555555555555555555555",
      "scope_sha256": "e75cbce01b89a8593197db87886d68ad7f7475e2c7bba3c454c528ddb92fc812",
      "observed_at": "2026-07-29T12:00:00Z",
      "result": "pass",
      "immutable": true,
      "authenticated": true,
      "reviewed": true
    },
    {
      "code": "publication-manifest",
      "type": "publication-manifest",
      "issuer_role": "software-producer",
      "uri": "https://evidence.example.invalid/slsa/publication-manifest.json",
      "sha256": "6666666666666666666666666666666666666666666666666666666666666666",
      "scope_sha256": "e75cbce01b89a8593197db87886d68ad7f7475e2c7bba3c454c528ddb92fc812",
      "observed_at": "2026-07-29T12:00:00Z",
      "result": "pass",
      "immutable": true,
      "authenticated": true,
      "reviewed": true
    },
    {
      "code": "consumer-verification-result",
      "type": "consumer-verification-result",
      "issuer_role": "consumer",
      "uri": "https://evidence.example.invalid/slsa/consumer-verification-result.json",
      "sha256": "8888888888888888888888888888888888888888888888888888888888888888",
      "scope_sha256": "e75cbce01b89a8593197db87886d68ad7f7475e2c7bba3c454c528ddb92fc812",
      "observed_at": "2026-07-29T12:00:00Z",
      "result": "finding",
      "immutable": true,
      "authenticated": true,
      "reviewed": true
    },
    {
      "code": "consumer-trust-policy",
      "type": "consumer-trust-policy",
      "issuer_role": "consumer",
      "uri": "https://evidence.example.invalid/slsa/consumer-trust-policy.json",
      "sha256": "9999999999999999999999999999999999999999999999999999999999999999",
      "scope_sha256": "e75cbce01b89a8593197db87886d68ad7f7475e2c7bba3c454c528ddb92fc812",
      "observed_at": "2026-07-29T12:00:00Z",
      "result": "pass",
      "immutable": true,
      "authenticated": true,
      "reviewed": true
    },
    {
      "code": "provenance-signature-verification",
      "type": "provenance-signature-verification",
      "issuer_role": "consumer",
      "uri": "https://evidence.example.invalid/slsa/provenance-signature-verification.json",
      "sha256": "aaaaaaaaaaaaaaaaaaaaaaaaaaaaaaaaaaaaaaaaaaaaaaaaaaaaaaaaaaaaaaaa",
      "scope_sha256": "e75cbce01b89a8593197db87886d68ad7f7475e2c7bba3c454c528ddb92fc812",
      "observed_at": "2026-07-29T12:00:00Z",
      "result": "pass",
      "immutable": true,
      "authenticated": true,
      "reviewed": true
    },
    {
      "code": "signer-ownership-assessment",
      "type": "signer-ownership-assessment",
      "issuer_role": "security-review",
      "uri": "https://evidence.example.invalid/slsa/signer-ownership-assessment.json",
      "sha256": "bbbbbbbbbbbbbbbbbbbbbbbbbbbbbbbbbbbbbbbbbbbbbbbbbbbbbbbbbbbbbbbb",
      "scope_sha256": "e75cbce01b89a8593197db87886d68ad7f7475e2c7bba3c454c528ddb92fc812",
      "observed_at": "2026-07-29T12:00:00Z",
      "result": "finding",
      "immutable": true,
      "authenticated": true,
      "reviewed": true
    }
  ]
}
